[
  {
    "provider": "openai",
    "model": "gpt-4o",
    "success": true,
    "content": "```json\n{\n  \"provider\": \"openai\",\n  \"recommendation\": \"CRUD with audit log\",\n  \"approaches\": [\n    {\n      \"name\": \"CRUD with audit log\",\n      \"pros\": [\n        \"Familiar to the team — Django ORM is purpose-built for CRUD\",\n        \"Simple to implement and maintain\",\n        \"PostgreSQL triggers or Django signals can capture changes for audit\",\n        \"Low learning curve, fast time to market\"\n      ],\n      \"cons\": [\n        \"Audit log is a bolt-on, not native to the data model\",\n        \"Harder to replay history or reconstruct past states\",\n        \"May need refactoring if event-driven features grow significantly\"\n      ],\n      \"risk_level\": \"low\",\n      \"fit_rating\": \"excellent\"\n    },\n    {\n      \"name\": \"Event sourcing\",\n      \"pros\": [\n        \"Complete audit trail is inherent — every state change is an event\",\n        \"Natural fit for the future recommendation engine (event stream as input)\",\n        \"Enables temporal queries and state reconstruction\"\n      ],\n      \"cons\": [\n        \"Steep learning curve for a team with no ES experience\",\n        \"Requires new infrastructure (event store, projections, possibly CQRS)\",\n        \"Django ORM is not designed for event sourcing — fighting the framework\",\n        \"Significantly more complex for 1000 orders/day which doesn't demand it\"\n      ],\n      \"risk_level\": \"high\",\n      \"fit_rating\": \"poor\"\n    }\n  ],\n  \"summary\": \"For a team of 3 with Django expertise and no event sourcing experience, CRUD with a dedicated audit log table is the pragmatic choice. The order volume (1000/day) doesn't justify the complexity of event sourcing. If the recommendation engine later needs an event stream, you can publish domain events from the CRUD layer without fully adopting event sourcing.\"\n}\n```"
  },
  {
    "provider": "anthropic",
    "model": "claude-sonnet-4-20250514",
    "success": true,
    "content": "```json\n{\n  \"provider\": \"anthropic\",\n  \"recommendation\": \"CRUD with domain events\",\n  \"approaches\": [\n    {\n      \"name\": \"CRUD with domain events\",\n      \"pros\": [\n        \"Keeps the familiar Django CRUD model the team knows\",\n        \"Domain events (published via Celery) provide an event stream for the recommendation engine\",\n        \"Audit trail via a changes table with before/after snapshots\",\n        \"Incremental path — can evolve toward event sourcing later if needed\"\n      ],\n      \"cons\": [\n        \"Dual-write concern: must ensure both the CRUD update and event publish succeed\",\n        \"Audit trail is still a secondary concern, not the primary data model\",\n        \"Domain events need schema versioning as the system evolves\"\n      ],\n      \"risk_level\": \"low\",\n      \"fit_rating\": \"good\"\n    },\n    {\n      \"name\": \"Event sourcing\",\n      \"pros\": [\n        \"Audit trail and event stream are first-class citizens\",\n        \"Natural fit for temporal queries and state reconstruction\",\n        \"Recommendation engine gets a native event stream\"\n      ],\n      \"cons\": [\n        \"Team has no ES experience — high ramp-up cost\",\n        \"Django and PostgreSQL are not natural ES tools\",\n        \"CQRS adds operational complexity (projections, eventual consistency)\",\n        \"Over-engineered for current scale\"\n      ],\n      \"risk_level\": \"high\",\n      \"fit_rating\": \"poor\"\n    },\n    {\n      \"name\": \"Plain CRUD\",\n      \"pros\": [\n        \"Simplest possible approach\",\n        \"Team can deliver quickly\"\n      ],\n      \"cons\": [\n        \"No audit trail without additional work\",\n        \"No event stream for future recommendation engine\",\n        \"May require significant rework later\"\n      ],\n      \"risk_level\": \"medium\",\n      \"fit_rating\": \"fair\"\n    }\n  ],\n  \"summary\": \"CRUD with domain events strikes the best balance: it leverages the team's Django expertise, provides an audit trail, and creates the event stream the recommendation engine will need — all without the complexity of full event sourcing. Use Django signals to publish order events to a Celery queue, and store audit snapshots in a dedicated table. This positions you to evolve toward event sourcing incrementally if scale demands it.\"\n}\n```"
  }
]
