[
  {
    "provider": "openai",
    "model": "gpt-4o",
    "success": true,
    "content": "```json\n{\n  \"provider\": \"openai\",\n  \"quality_rating\": \"fair\",\n  \"issues\": [\n    {\n      \"severity\": \"high\",\n      \"location\": \"backend/app/services/auth.py:23\",\n      \"category\": \"correctness\",\n      \"description\": \"Using SHA-256 for password hashing is insecure. SHA-256 is fast and vulnerable to brute-force attacks.\",\n      \"suggestion\": \"Use bcrypt or argon2 for password hashing. Replace hashlib.sha256 with bcrypt.checkpw.\"\n    },\n    {\n      \"severity\": \"medium\",\n      \"location\": \"backend/app/api/routes/auth.py:11\",\n      \"category\": \"correctness\",\n      \"description\": \"auth_service is referenced but never defined in this module. This will raise a NameError at runtime.\",\n      \"suggestion\": \"Inject AuthService via Flask's app context or a dependency injection pattern.\"\n    },\n    {\n      \"severity\": \"low\",\n      \"location\": \"backend/app/services/auth.py:34\",\n      \"category\": \"maintainability\",\n      \"description\": \"get_current_user returns None for invalid tokens. Consider raising an exception for consistency with the login method.\",\n      \"suggestion\": \"Raise AuthError for invalid tokens, or document the None-return contract clearly.\"\n    }\n  ],\n  \"praise\": [\n    \"Clean separation between service and route layers.\",\n    \"Good use of type hints throughout.\"\n  ],\n  \"summary\": \"The authentication implementation has a critical security flaw (SHA-256 for passwords) and a runtime error (undefined auth_service). The code structure is clean but needs these issues addressed before deployment.\"\n}\n```"
  },
  {
    "provider": "anthropic",
    "model": "claude-sonnet-4-20250514",
    "success": true,
    "content": "```json\n{\n  \"provider\": \"anthropic\",\n  \"quality_rating\": \"fair\",\n  \"issues\": [\n    {\n      \"severity\": \"high\",\n      \"location\": \"backend/app/services/auth.py:23\",\n      \"category\": \"correctness\",\n      \"description\": \"SHA-256 is not a suitable password hashing algorithm. It lacks salting and is too fast, making it vulnerable to rainbow table and brute-force attacks.\",\n      \"suggestion\": \"Use bcrypt: import bcrypt; bcrypt.checkpw(password.encode(), user.password_hash.encode()).\"\n    },\n    {\n      \"severity\": \"medium\",\n      \"location\": \"backend/app/api/routes/auth.py:13\",\n      \"category\": \"correctness\",\n      \"description\": \"auth_service is used as a module-level variable but is never initialised. This will cause a NameError.\",\n      \"suggestion\": \"Use Flask's current_app pattern or a factory function to provide the AuthService instance.\"\n    },\n    {\n      \"severity\": \"medium\",\n      \"location\": \"backend/app/services/auth.py:27\",\n      \"category\": \"architecture\",\n      \"description\": \"Session token generation uses os.urandom which is correct, but the token is stored as plain text. Consider hashing the stored token.\",\n      \"suggestion\": \"Store a hash of the token in the database and compare hashes on lookup.\"\n    }\n  ],\n  \"praise\": [\n    \"Type hints are consistently applied.\",\n    \"Error messages in AuthError don't leak whether the email or password was wrong — good security practice.\"\n  ],\n  \"summary\": \"The code follows good structural patterns with a clean service/route split, but has a critical password hashing vulnerability and an undefined variable that would prevent the route from working. Token storage could also be improved.\"\n}\n```"
  },
  {
    "provider": "gemini",
    "model": "gemini-2.0-flash",
    "success": true,
    "content": "```json\n{\n  \"provider\": \"gemini\",\n  \"quality_rating\": \"fair\",\n  \"issues\": [\n    {\n      \"severity\": \"high\",\n      \"location\": \"backend/app/services/auth.py:23\",\n      \"category\": \"correctness\",\n      \"description\": \"Password hashing uses SHA-256 which is cryptographically unsuitable for password storage. Project rules explicitly require bcrypt.\",\n      \"suggestion\": \"Replace with bcrypt. Install the bcrypt package and use bcrypt.hashpw/bcrypt.checkpw.\"\n    },\n    {\n      \"severity\": \"medium\",\n      \"location\": \"backend/app/api/routes/auth.py:11\",\n      \"category\": \"correctness\",\n      \"description\": \"The variable auth_service is referenced but never defined or imported.\",\n      \"suggestion\": \"Create the AuthService instance via a factory or inject it through Flask's application context.\"\n    },\n    {\n      \"severity\": \"low\",\n      \"location\": \"backend/app/api/routes/auth.py:22\",\n      \"category\": \"craftsmanship\",\n      \"description\": \"The /me endpoint lacks a docstring.\",\n      \"suggestion\": \"Add a Google-style docstring per project rules.\"\n    }\n  ],\n  \"praise\": [\n    \"Service layer is cleanly separated from routes.\",\n    \"Consistent error handling pattern in the login endpoint.\"\n  ],\n  \"summary\": \"Solid architectural foundation with clean separation of concerns. The SHA-256 password hashing is the most critical issue and directly violates project rules. The undefined auth_service variable would also prevent the code from running.\"\n}\n```"
  },
  {
    "provider": "deepseek",
    "model": "deepseek-r1",
    "success": false,
    "error": "Request timed out after 60s"
  }
]
